{
  "$schema": "./cubis-foundry-pattern-registry-v1.schema.json",
  "generatedAt": "1970-01-01T00:00:00.000Z",
  "auditedReferences": [
    {
      "runtime": "antigravity",
      "audit_source_id": "antigravity-compat-ref",
      "audited_commit": null,
      "audited_at": "2026-04-04",
      "audited_version_or_date": "2026-04-04",
      "source_type": "inferred-compatibility",
      "source_summary": "Compatibility target derived from Foundry's Antigravity adapter shape and Gemini-family routing model.",
      "evidence": [
        {
          "kind": "inferred",
          "scope": "mixed",
          "stability": "inferred",
          "source": "workflows/workflows/agent-environment-setup/platforms/antigravity",
          "notes": "No public vendor spec was verified in this audit; Foundry treats Antigravity as an inferred compatibility target only."
        }
      ]
    },
    {
      "runtime": "claude",
      "audit_source_id": "claude-audit-ref",
      "audited_commit": "1ac2b97df6199f8f76b3896d28f470ea44a90c25",
      "audited_at": "2026-04-04",
      "audited_version_or_date": "2026-04-04",
      "source_type": "official-doc",
      "source_summary": "Anthropic Claude Code docs confirm native settings, hooks, project commands, and subagents.",
      "evidence": [
        {
          "kind": "official-doc",
          "scope": "repo",
          "stability": "stable",
          "source": "https://docs.anthropic.com/en/docs/claude-code/settings",
          "notes": "Settings docs describe project/user settings, CLAUDE.md, hooks, and .claude/agents/*.md subagents."
        },
        {
          "kind": "official-doc",
          "scope": "repo",
          "stability": "stable",
          "source": "https://docs.anthropic.com/en/docs/claude-code/tutorials",
          "notes": "Tutorial docs describe project-specific slash commands under .claude/commands."
        }
      ]
    },
    {
      "runtime": "codex",
      "audit_source_id": "codex-audit-ref",
      "audited_commit": "782a03a2d4eb69d475075cbd6df6c1af4fb35e64",
      "audited_at": "2026-04-04",
      "audited_version_or_date": "codex-cli 0.118.0 / 2026-04-04",
      "source_type": "mixed",
      "source_summary": "OpenAI Codex docs confirm AGENTS.md, skills, subagents, and hooks; local CLI confirms the current feature-gating state.",
      "evidence": [
        {
          "kind": "official-doc",
          "scope": "repo",
          "stability": "stable",
          "source": "https://developers.openai.com/codex/skills",
          "notes": "Codex docs describe repository skills under .agents/skills and related AGENTS.md guidance."
        },
        {
          "kind": "official-doc",
          "scope": "repo",
          "stability": "experimental",
          "source": "https://developers.openai.com/codex/hooks",
          "notes": "Codex docs describe project hook events including UserPromptSubmit and Stop."
        },
        {
          "kind": "local-cli",
          "scope": "cli",
          "stability": "experimental",
          "source": "codex-cli 0.118.0",
          "notes": "Local feature inspection still exposes codex_hooks as under development, so Foundry keeps hook emission gated."
        }
      ]
    },
    {
      "runtime": "copilot",
      "audit_source_id": "copilot-docs-ref",
      "audited_commit": null,
      "audited_at": "2026-04-04",
      "audited_version_or_date": "2026-04-04",
      "source_type": "official-doc",
      "source_summary": "GitHub Docs confirm repository instructions, AGENTS.md, prompt files, skills, custom agents, hooks, and coding-agent surfaces, with feature availability varying by surface.",
      "evidence": [
        {
          "kind": "official-doc",
          "scope": "mixed",
          "stability": "stable",
          "source": "https://docs.github.com/en/copilot/how-tos/configure-custom-instructions/add-repository-instructions?tool=vscode",
          "notes": "GitHub documents repository custom instructions, AGENTS.md agent instructions, and companion instruction files."
        },
        {
          "kind": "official-doc",
          "scope": "cli",
          "stability": "stable",
          "source": "https://docs.github.com/en/copilot/how-tos/copilot-cli/customize-copilot/create-skills",
          "notes": "Copilot CLI docs describe skills and project skill locations."
        },
        {
          "kind": "official-doc",
          "scope": "cli",
          "stability": "stable",
          "source": "https://docs.github.com/copilot/how-tos/copilot-cli/use-copilot-cli-agents/invoke-custom-agents",
          "notes": "Copilot CLI docs describe custom agents as a first-class surface."
        },
        {
          "kind": "official-doc",
          "scope": "ide",
          "stability": "preview",
          "source": "https://docs.github.com/en/enterprise-cloud@latest/copilot/concepts/prompting/response-customization",
          "notes": "Prompt files are documented as preview and limited to supported IDE surfaces."
        }
      ]
    },
    {
      "runtime": "gemini",
      "audit_source_id": "gemini-docs-ref",
      "audited_commit": null,
      "audited_at": "2026-04-04",
      "audited_version_or_date": "2026-04-04",
      "source_type": "official-doc",
      "source_summary": "Gemini CLI docs confirm GEMINI.md, commands, settings, hooks, MCP, skills, and experimental remote subagents.",
      "evidence": [
        {
          "kind": "official-doc",
          "scope": "repo",
          "stability": "stable",
          "source": "https://geminicli.com/docs/cli/custom-commands/",
          "notes": "Gemini CLI docs describe project and global .gemini/commands command files."
        },
        {
          "kind": "official-doc",
          "scope": "repo",
          "stability": "stable",
          "source": "https://geminicli.com/docs/",
          "notes": "Gemini docs list GEMINI.md project context, agent skills, settings, and MCP as supported features."
        },
        {
          "kind": "official-doc",
          "scope": "mixed",
          "stability": "experimental",
          "source": "https://geminicli.com/docs/core/remote-agents/",
          "notes": "Gemini docs describe remote subagents as an experimental feature that must be explicitly enabled."
        }
      ]
    }
  ],
  "orchestrationSubtypes": [
    {
      "id": "command-agent-skill",
      "label": "command -> agent -> skill",
      "source_repos": [
        "claude-audit-ref",
        "foundry"
      ],
      "canonical_projection": "Workflow entrypoint resolves intent, hands off to a specialist agent, loads supporting skills, and validates the outcome."
    },
    {
      "id": "skill-skill",
      "label": "skill -> skill",
      "source_repos": [
        "codex-audit-ref"
      ],
      "canonical_projection": "Composable skill pipeline with a typed handoff contract between sequential skills."
    },
    {
      "id": "orchestrator-specialists-validator",
      "label": "orchestrator -> specialists -> validator",
      "source_repos": [
        "foundry",
        "claude-audit-ref",
        "codex-audit-ref"
      ],
      "canonical_projection": "Control-plane orchestration pattern where an orchestrator delegates to specialists and accepts only validated outputs."
    }
  ],
  "patterns": [
    {
      "pattern_id": "instructions-file",
      "id": "instructions-file",
      "category": "instructions",
      "intent": "Expose a root instruction file that Foundry can install and document per runtime.",
      "source_repos": [
        "claude-audit-ref",
        "codex-audit-ref"
      ],
      "canonical_surface": "One primary repository instruction file is installed at the runtime's canonical path.",
      "canonical_user_experience": "One primary repository instruction file is installed at the runtime's canonical path.",
      "required_capabilities": [
        "instruction-file",
        "project-rules-surface"
      ],
      "required_runtime_capabilities": [
        "instruction-file",
        "project-rules-surface"
      ],
      "degraded_projection_policy": "If the runtime has multiple rule surfaces, Foundry declares one primary instruction surface and documents additional runtime-owned companions.",
      "projection_rules": "If the runtime has multiple rule surfaces, Foundry declares one primary instruction surface and documents additional runtime-owned companions.",
      "acceptance_contract": "Each platform publishes one install target for repository-level instructions.",
      "docs_contract": "Document file name, install path, and whether companion rule files also exist.",
      "test_contract": "Generated docs and install metadata must agree on the primary instruction path."
    },
    {
      "pattern_id": "instructions-hierarchy",
      "id": "instructions-hierarchy",
      "category": "instructions",
      "intent": "Describe how runtime instruction files layer and override one another.",
      "source_repos": [
        "claude-audit-ref",
        "codex-audit-ref"
      ],
      "canonical_surface": "Foundry records load order, precedence, and monorepo behavior for each runtime.",
      "canonical_user_experience": "Foundry records load order, precedence, and monorepo behavior for each runtime.",
      "required_capabilities": [
        "hierarchical-instruction-loading"
      ],
      "required_runtime_capabilities": [
        "hierarchical-instruction-loading"
      ],
      "degraded_projection_policy": "If hierarchy is not fully native, Foundry documents the degraded loading contract and keeps repo rules route-first.",
      "projection_rules": "If hierarchy is not fully native, Foundry documents the degraded loading contract and keeps repo rules route-first.",
      "acceptance_contract": "Each platform declares precedence and whether descendant or ancestor loading is native or degraded.",
      "docs_contract": "Document load order, precedence, and monorepo notes.",